from,to,text,where,time,movie_num,text_processed
gold five,,Gold Five to Red Leader...,INT. GOLD FIVE'S Y-WING - COCKPIT,,4,gold five to red leader
gold five,,"(over headset) Lost Tiree, lost Dutch.",INT. LUKE'S X-WING FIGHTER - COCKPIT,,4,over headset lost tiree lost dutch
red leader,,"I copy, Gold Five.",INT. RED LEADER'S COCKPIT,,4,i copy gold five
gold five,,They came from behind...,INT. GOLD FIVE'S Y-WING - COCKPIT,,4,they came from behind
officer,,"We've analyzed their attack, sir, and there is a danger. Should I have your ship standing by?",INT. DEATH STAR - CONTROL ROOM,,4,weve analyzed their attack sir and there is a danger should i have your ship standing by
tarkin,,Evacuate? In out moment of triumph? I think you overestimate their chances!,INT. DEATH STAR - CONTROL ROOM,,4,evacuate in out moment of triumph i think you overestimate their chances
voice,,"(over speaker) Rebel base, three minutes and closing.",INT. DEATH STAR - CONTROL ROOM,,4,over speaker rebel base three minutes and closing
red leader,,"Red Group, this is Red Leader.",INT. READ LEADER'S COCKPIT,,4,red group this is red leader
red leader,,(over speaker) Rendezvous at mark six point one.,INT. MASSASSI OUTPOST - WAR ROOM,,4,over speaker rendezvous at mark six point one
wedge,,(over speaker) This is Red Two. Flying toward you.,INT. MASSASSI OUTPOST - WAR ROOM,,4,over speaker this is red two flying toward you
biggs,,"(over speaker) Red Three, standing by.",INT. MASSASSI OUTPOST - WAR ROOM,,4,over speaker red three standing by
dodonna,,"(over headset) Red Leader, this is Base One. Keep half your group out of range for the next run.",INT. RED LEADER'S COCKPIT,,4,over headset red leader this is base one keep half your group out of range for the next run
red leader,,"(over headset) Copy, Base One. Luke, take Red Two and Three. Hold up here and wait for my signal... to start your run.",INT. LUKE'S X-WING FIGHTER - COCKPIT,,4,over headset copy base one luke take red two and three hold up here and wait for my signal to start your run
red leader,,This is it!,INT. RED LEADER'S COCKPIT,,4,this is it
red ten,,We should be able to see it by now.,INT. RED TEN'S COCKPIT,,4,we should be able to see it by now
red leader,,Keep your eyes open for those fighters!,INT. RED LEADER'S COCKPIT,,4,keep your eyes open for those fighters
red ten,,There's too much interference!,INT. RED TEN'S COCKPIT,,4,theres too much interference
red ten,,"Red Five, can you see them from where you are?",EXT. SPACE - DEATH STAR TRENCH,,4,red five can you see them from where you are
luke,,No sign of any... wait!,INT. LUKE'S X-WING FIGHTER - COCKPIT,,4,no sign of any wait
luke,,(over headset) Coming in point three five.,INT. RED TEN'S COCKPIT,,4,over headset coming in point three five
red ten,,I see them.,INT. RED TEN'S COCKPIT,,4,i see them
red leader,,I'm in range.,INT. RED LEADER'S COCKPIT,,4,im in range
red leader,,Target's coming up!,INT. RED LEADER'S COCKPIT,,4,targets coming up
red leader,,Just hold them off for a few seconds.,INT. RED LEADER'S COCKPIT,,4,just hold them off for a few seconds
darth vader,,Close up formation.,INT. DARTH VADER'S COCKPIT,,4,close up formation
red ten,,You'd better let her loose.,INT. RED TEN'S COCKPIT,,4,youd better let her loose
red leader,,Almost there!,INT. RED LEADER'S COCKPIT,,4,almost there
red ten,,I can't hold them!,INT. RED TEN'S COCKPIT,,4,i cant hold them
red leader,,It's away!,INT. RED LEADER'S COCKPIT,,4,its away
red nine,,(over speaker) It's a hit!,INT. MASSASSI OUTPOST - WAR ROOM,,4,over speaker its a hit
red leader,,(over speaker) Negative.,INT. MASSASSI OUTPOST - WAR ROOM,,4,over speaker negative
red leader,,Negative! It didn't go in. It just impacted on the surface.,INT. RED LEADER'S COCKPIT,,4,negative it didnt go in it just impacted on the surface
luke,,"(over headset) Red Leader, we're right above you. Turn to point...",INT. RED LEADER'S COCKPIT,,4,over headset red leader were right above you turn to point
luke,,...oh-five; we'll cover for you.,INT. LUKE'S X-WING FIGHTER - COCKPIT,,4,ohfive well cover for you
red leader,,(over headset) Stay there...,INT. LUKE'S X-WING FIGHTER - COCKPIT,,4,over headset stay there
red leader,,...I just lost my starboard engine.,INT. RED LEADER'S COCKPIT,,4,i just lost my starboard engine
red leader,,(over headset) Get set to make your attack run.,INT. LUKE'S X-WING FIGHTER - COCKPIT,,4,over headset get set to make your attack run
death star intercom voice,,"Rebel base, one minute and closing.",INT. DEATH STAR,,4,rebel base one minute and closing
luke,,"(over speaker) Biggs, Wedge, let's close it up. We're going in. We're going in full throttle.",INT. MASSASSI OUTPOST - WAR ROOM,,4,over speaker biggs wedge lets close it up were going in were going in full throttle
wedge,,"Right with you, boss.",INT. WEDGE'S COCKPIT,,4,right with you boss
biggs,,"Luke, at that speed will you be able to pull out in time?",INT. BIGGS' COCKPIT,,4,luke at that speed will you be able to pull out in time
luke,,It'll be just like Beggar's Canyon back home.,INT. LUKE'S X-WING FIGHTER - COCKPIT,,4,itll be just like beggars canyon back home
biggs,,We'll stay back far enough to cover you.,INT. BIGGS' COCKPIT,,4,well stay back far enough to cover you
wedge,,"(over headset) My scope shows the tower, but I can't see the exhaust port! Are you sure the computer can hit it?",INT. LUKE'S COCKPIT,,4,over headset my scope shows the tower but i cant see the exhaust port are you sure the computer can hit it
luke,,Watch yourself! Increase speed full throttle!,INT. LUKE'S X-WING FIGHTER - COCKPIT,,4,watch yourself increase speed full throttle
wedge,,What about the tower?,INT. WEDGE'S COCKPIT,,4,what about the tower
luke,,You worry about those fighters! I'll worry about the tower!,INT. LUKE'S X-WING FIGHTER - COCKPIT,,4,you worry about those fighters ill worry about the tower
luke,,"(to ARTOO) ARTOO... that, that stabilizer's broken loose again! See if you can't lock it down!",INT. LUKE'S X-WING FIGHTER - COCKPI,,4,to artoo artoo that that stabilizers broken loose again see if you cant lock it down
wedge,,(over speaker) I'm hit! I can't stay with you.,INT. MASSASSI OUTPOST - WAR ROOM,,4,over speaker im hit i cant stay with you
luke,,"(over speaker) Get clear, Wedge.",INT. MASSASSI OUTPOST - WAR ROOM,,4,over speaker get clear wedge
luke,,You can't do any more good back there!,INT. LUKE'S X-WING FIGHTER - COCKPIT,,4,you cant do any more good back there
wedge,,Sorry!,INT. WEDGE'S COCKPIT,,4,sorry
darth vader,,Let him go! Stay on the leader!,INT. DARTH VADER'S COCKPIT,,4,let him go stay on the leader
biggs,,"Hurry, Luke, they're coming in much faster this time. I can't hold them!",INT. BIGGS' COCKPIT,,4,hurry luke theyre coming in much faster this time i cant hold them
luke,,"ARTOO, try and increase the power!",INT. BIGGS' COCKPIT,,4,artoo try and increase the power
biggs,,"(over headset) Hurry up, Luke!",INT. LUKE'S X-WING FIGHTER,,4,over headset hurry up luke
biggs,,Wait!,INT. BIGGS' COCKPIT,,4,wait
death star intercom voice,,"Rebel base, thirty seconds and closing.",INT. DEATH STAR - CONTROL ROOM,,4,rebel base thirty seconds and closing
darth vader,,I'm on the leader.,INT. DARTH VADER'S COCKPIT,,4,im on the leader
threepio,,"Hang on, ARTOO!",INT. MASSASSI OUTPOST - WAR ROOM,,4,hang on artoo
obi wan,,"Use the Force, Luke.",INT. LUKE'S X-WING - COCKPIT,,4,use the force luke
obi wan,,"Let go, Luke.",INT. LUKE'S X-WING - COCKPIT,,4,let go luke
darth vader,,The Force is strong with this one!,INT. DARTH VADER'S COCKPIT,,4,the force is strong with this one
obi wan,,"Luke, trust me.",INT. LUKE'S X-WING - COCKPIT,,4,luke trust me
base voice,,"(over speaker) His computer's off. Luke, you switched off your targeting computer. What's wrong?",INT. MASSASSI OUTPOST - WAR ROOM,,4,over speaker his computers off luke you switched off your targeting computer whats wrong
luke,,(over speaker) Nothing. I'm all right.,INT. MASSASSI OUTPOST - WAR ROOM,,4,over speaker nothing im all right
luke,,I've lost ARTOO!,INT. MASSASSI OUTPOST - WAR ROOM,,4,ive lost artoo
massassi intercom voice,,The Death Star has cleared the planet. The Death Star has cleared the planet.,INT. MASSASSI OUTPOST - WAR ROOM,,4,the death star has cleared the planet the death star has cleared the planet
death star intercom voice,,"Rebel base, in range.",INT. DEATH STAR - CONTROL ROOM,,4,rebel base in range
tarkin,,You may fire when ready.,INT. DEATH STAR - CONTROL ROOM,,4,you may fire when ready
death star intercom voice,,Commence primary ignition.,INT. DEATH STAR - CONTROL ROOM,,4,commence primary ignition
darth vader,,I have you now.,INT. DARTH VADER'S COCKPIT,,4,i have you now
darth vader,,What?,INT. DARTH VADER'S COCKPIT,,4,what
han solo,,(yelling) Yahoo!,INT. DARTH VADER'S COCKPIT,,4,yelling yahoo
wingman,,Look out!,INT. WINGMAN'S COCKPIT,,4,look out
han solo,,"(into mike) You're all clear, kid.",INT. MILLENNIUM FALCON - COCKPIT,,4,into mike youre all clear kid
han solo,,(over speaker) Now let's blow this thing and go home!,INT. MASSASSI OUTPOST - WAR ROOM,,4,over speaker now lets blow this thing and go home
intercom voice,,Stand by to fire at Rebel base.,INT. DEATH STAR,,4,stand by to fire at rebel base
intercom voice,,Standing by.,INT. DEATH STAR,,4,standing by
han solo,,"Great shot, kid. That was one in a million.",INT. MILLENNIUM FALCON - COCKPIT,,4,great shot kid that was one in a million
obi wan,,"Remember, the Force will be with you... always.",INT. LUKE'S X-WING FIGHTER - COCKPIT,,4,remember the force will be with you always
leia,,Luke! Luke! Luke!,INT. MASSASSI OUTPOST - MAIN HANGAR,,4,luke luke luke
han solo,,(laughing) Hey! Hey!,INT. MASSASSI OUTPOST - MAIN HANGAR,,4,laughing hey hey
luke,,(laughing) I knew you'd come back! I just knew it!,INT. MASSASSI OUTPOST - MAIN HANGAR,,4,laughing i knew youd come back i just knew it
han solo,,"Well, I wasn't gonna let you get all the credit and take all the reward.",INT. MASSASSI OUTPOST - MAIN HANGAR,,4,well i wasnt gonna let you get all the credit and take all the reward
leia,,"(laughing) Hey, I knew there was more to you than money.",INT. MASSASSI OUTPOST - MAIN HANGAR,,4,laughing hey i knew there was more to you than money
luke,,"Oh, no!",INT. MASSASSI OUTPOST - MAIN HANGAR,,4,oh no
threepio,,"Oh, my! ARTOO! Can you hear me? Say something! (to mechanic) You can repair him, can't you?",INT. MASSASSI OUTPOST - MAIN HANGAR,,4,oh my artoo can you hear me say something to mechanic you can repair him cant you
technician,,We'll get to work on him right away.,INT. MASSASSI OUTPOST - MAIN HANGAR,,4,well get to work on him right away
threepio,,"You must repair him! Sir, if any of my circuits or gears will help, I'll gladly donate them.",INT. MASSASSI OUTPOST - MAIN HANGAR,,4,you must repair him sir if any of my circuits or gears will help ill gladly donate them
luke,,He'll be all right.,INT. MASSASSI OUTPOST - MAIN HANGAR,,4,hell be all right
luke,,"(into comlink) Echo Three to Echo Seven. Han, old buddy, do you read me?",EXT. PLAIN OF HOTH - DAY,,5,into comlink echo three to echo seven han old buddy do you read me
han,,"(over comlink) Loud and clear, kid. What's up?",EXT. PLAIN OF HOTH - DAY,,5,over comlink loud and clear kid whats up
luke,,"(into comlink) Well, I finished my circle. I don't pick up any life readings.",EXT. PLAIN OF HOTH - DAY,,5,into comlink well i finished my circle i dont pick up any life readings
han,,"(over comlink) There isn't enough life on this ice cube to fill a space cruiser. The sensors are placed, I'm going back.",EXT. PLAIN OF HOTH - DAY,,5,over comlink there isnt enough life on this ice cube to fill a space cruiser the sensors are placed im going back
luke,,(into comlink) Right. I'll see you shortly. There's a meteorite that hit the ground near here. I want to check it out. It won't take long.,EXT. PLAIN OF HOTH - DAY,,5,into comlink right ill see you shortly theres a meteorite that hit the ground near here i want to check it out it wont take long
luke,,"Hey, steady girl. What's the matter? You smell something?",EXT. PLAIN OF HOTH - DAY,,5,hey steady girl whats the matter you smell something
luke,,Aaargh!,EXT. PLAIN OF HOTH - DAY,,5,aaargh
han,,Chewie!,INT. HOTH - REBEL BASE - MAIN HANGAR DECK,,5,chewie
han,,"All right, don't lose your temper. I'll come right back and give you a hand.",INT. HOTH - REBEL BASE - MAIN HANGAR DECK,,5,all right dont lose your temper ill come right back and give you a hand
rieekan,,Solo?,INT. HOTH - REBEL BASE - COMMAND CENTER,,5,solo
han,,"No sign of life out there, General. The sensors are in place. You'll know if anything comes around.",INT. HOTH - REBEL BASE - COMMAND CENTER,,5,no sign of life out there general the sensors are in place youll know if anything comes around
rieekan,,Commander Skywalker reported in yet?,INT. HOTH - REBEL BASE - COMMAND CENTER,,5,commander skywalker reported in yet
han,,No. He's checking out a meteorite that hit near him.,INT. HOTH - REBEL BASE - COMMAND CENTER,,5,no hes checking out a meteorite that hit near him
rieekan,,"(indicates radar screen) With all the meteor activity in this system, it's going to be difficult to spot approaching ships.",INT. HOTH - REBEL BASE - COMMAND CENTER,,5,indicates radar screen with all the meteor activity in this system its going to be difficult to spot approaching ships
han,,"General, I've got to leave. I can't stay anymore.",INT. HOTH - REBEL BASE - COMMAND CENTER,,5,general ive got to leave i cant stay anymore
rieekan,,I'm sorry to hear that.,INT. HOTH - REBEL BASE - COMMAND CENTER,,5,im sorry to hear that
han,,"Well, there's a price on my head. If I don't pay off Jabba the Hut, I'm a dead man.",INT. HOTH - REBEL BASE - COMMAND CENTER,,5,well theres a price on my head if i dont pay off jabba the hut im a dead man
rieekan,,"A death mark's not an easy thing to live with. You're a good fighter, Solo. I hate to lose you.",INT. HOTH - REBEL BASE - COMMAND CENTER,,5,a death marks not an easy thing to live with youre a good fighter solo i hate to lose you
han,,"Thank you, General.",INT. HOTH - REBEL BASE - COMMAND CENTER,,5,thank you general
han,,"(with feeling) Well, Your Highness, I guess this is it.",INT. HOTH - REBEL BASE - COMMAND CENTER,,5,with feeling well your highness i guess this is it
leia,,That's right.,INT. HOTH - REBEL BASE - COMMAND CENTER,,5,thats right
han,,"(cooly) Well, don't get all mushy on me. So long, Princess.",INT. HOTH - REBEL BASE - COMMAND CENTER,,5,cooly well dont get all mushy on me so long princess
leia,,Han!,INT. HOTH - REBEL BASE - ICE CORRIDOR,,5,han
han,,"Yes, Your Highnessness?",INT. HOTH - REBEL BASE - ICE CORRIDOR,,5,yes your highnessness
leia,,I thought you decided to stay.,INT. HOTH - REBEL BASE - ICE CORRIDOR,,5,i thought you decided to stay
han,,"Well, the bounty hunter we ran into on Ord Mantell changed my mind.",INT. HOTH - REBEL BASE - ICE CORRIDOR,,5,well the bounty hunter we ran into on ord mantell changed my mind
leia,,"Han, we need you!",INT. HOTH - REBEL BASE - ICE CORRIDOR,,5,han we need you
han,,We?,INT. HOTH - REBEL BASE - ICE CORRIDOR,,5,we
leia,,Yes.,INT. HOTH - REBEL BASE - ICE CORRIDOR,,5,yes
han,,"Oh, what about you need?",INT. HOTH - REBEL BASE - ICE CORRIDOR,,5,oh what about you need
leia,,(mystified) I need? I don't know what you're talking about.,INT. HOTH - REBEL BASE - ICE CORRIDOR,,5,mystified i need i dont know what youre talking about
han,,"(shakes his head, fed up) You probably don't.",INT. HOTH - REBEL BASE - ICE CORRIDOR,,5,shakes his head fed up you probably dont
leia,,And what precisely am I supposed to know?,INT. HOTH - REBEL BASE - ICE CORRIDOR,,5,and what precisely am i supposed to know
han,,Come on! You want me to stay because of the way you feel about me.,INT. HOTH - REBEL BASE - ICE CORRIDOR,,5,come on you want me to stay because of the way you feel about me
leia,,Yes. You're a great help to us. You're a natural leader...,INT. HOTH - REBEL BASE - ICE CORRIDOR,,5,yes youre a great help to us youre a natural leader
han,,No! That's not it. Come on. Aahhh - uh huh! Come on.,INT. HOTH - REBEL BASE - ICE CORRIDOR,,5,no thats not it come on aahhh  uh huh come on
leia,,You're imagining things.,INT. HOTH - REBEL BASE - ICE CORRIDOR,,5,youre imagining things
han,,Am I? Then why are you following me? Afraid I was going to leave without giving you a goodbye kiss?,INT. HOTH - REBEL BASE - ICE CORRIDOR,,5,am i then why are you following me afraid i was going to leave without giving you a goodbye kiss
leia,,I'd just as soon kiss a Wookiee.,INT. HOTH - REBEL BASE - ICE CORRIDOR,,5,id just as soon kiss a wookiee
han,,I can arrange that. You could use a good kiss!,INT. HOTH - REBEL BASE - ICE CORRIDOR,,5,i can arrange that you could use a good kiss
threepio,,Don't try to blame me. I didn't ask you to turn on the thermal heater. I merely commented that it was freezing in the princess' chamber. But it's supposed to be freezing. How are we going to dry out all her clothes? I really don't know.,INT. HOTH - REBEL BASE - ANOTHER ICE CORRIDOR,,5,dont try to blame me i didnt ask you to turn on the thermal heater i merely commented that it was freezing in the princess chamber but its supposed to be freezing how are we going to dry out all her clothes i really dont know
threepio,,"Oh, switch off.",INT. HOTH - REBEL BASE - ANOTHER ICE CORRIDOR,,5,oh switch off
han,,(to Chewie) Why do you take this apart now? I'm trying to get us out of here and you pull both of these.,INT. HOTH - REBEL BASE - MAIN HANGAR DECK,,5,to chewie why do you take this apart now im trying to get us out of here and you pull both of these
threepio,,"Excuse me, sir.",INT. HOTH - REBEL BASE - MAIN HANGAR DECK,,5,excuse me sir
han,,(to Chewie) Put them back together right now.,INT. HOTH - REBEL BASE - MAIN HANGAR DECK,,5,to chewie put them back together right now
threepio,,"Might I have a word with you, please?",INT. HOTH - REBEL BASE - MAIN HANGAR DECK,,5,might i have a word with you please
han,,What do you want?,INT. HOTH - REBEL BASE - MAIN HANGAR DECK,,5,what do you want
threepio,,"Well, it's Princess Leia, sir. She's been trying to get you on the communicator.",INT. HOTH - REBEL BASE - MAIN HANGAR DECK,,5,well its princess leia sir shes been trying to get you on the communicator
han,,I turned it off. I don't want to talk to her.,INT. HOTH - REBEL BASE - MAIN HANGAR DECK,,5,i turned it off i dont want to talk to her
threepio,,"Oh. Well, Princess Leia is wondering about Master Luke. He hasn't come back yet. She doesn't know where he is.",INT. HOTH - REBEL BASE - MAIN HANGAR DECK,,5,oh well princess leia is wondering about master luke he hasnt come back yet she doesnt know where he is
han,,I don't know where he is.,INT. HOTH - REBEL BASE - MAIN HANGAR DECK,,5,i dont know where he is
threepio,,Nobody knows where he is.,INT. HOTH - REBEL BASE - MAIN HANGAR DECK,,5,nobody knows where he is
han,,"What do you mean, ""nobody knows""?",INT. HOTH - REBEL BASE - MAIN HANGAR DECK,,5,what do you mean nobody knows
threepio,,"Well, uh, you see...",INT. HOTH - REBEL BASE - MAIN HANGAR DECK,,5,well uh you see
han,,Deck Officer. Deck Officer!,INT. HOTH - REBEL BASE - MAIN HANGAR DECK,,5,deck officer deck officer
threepio,,"Excuse me, sir. Might I inqu...",INT. HOTH - REBEL BASE - MAIN HANGAR DECK,,5,excuse me sir might i inqu
deck officer,,"Yes, sir?",INT. HOTH - REBEL BASE - MAIN HANGAR DECK,,5,yes sir
han,,Do you know where Commander Skywalker is?,INT. HOTH - REBEL BASE - MAIN HANGAR DECK,,5,do you know where commander skywalker is
deck officer,,I haven't seen him. It's possible he came in through the south entrance.,INT. HOTH - REBEL BASE - MAIN HANGAR DECK,,5,i havent seen him its possible he came in through the south entrance
han,,It's possible? Why don't you go find out? It's getting dark out there.,INT. HOTH - REBEL BASE - MAIN HANGAR DECK,,5,its possible why dont you go find out its getting dark out there
deck officer,,"Yes, sir.",INT. HOTH - REBEL BASE - MAIN HANGAR DECK,,5,yes sir
threepio,,"Excuse me, sir. Might I inquire what's going on?",INT. HOTH - REBEL BASE - MAIN HANGAR DECK,,5,excuse me sir might i inquire whats going on
han,,Why not?,INT. HOTH - REBEL BASE - MAIN HANGAR DECK,,5,why not
threepio,,"Impossible man. Come along, ARTOO, let's find Princess Leia. Between ourselves, I think Master Luke is in considerable danger.",INT. HOTH - REBEL BASE - MAIN HANGAR DECK,,5,impossible man come along artoo lets find princess leia between ourselves i think master luke is in considerable danger
deck officer,,"Sir, Commander Skywalker hasn't come in through the south entrance. He might have forgotten to check in.",INT. HOTH - REBEL BASE - MAIN ICE TUNNEL,,5,sir commander skywalker hasnt come in through the south entrance he might have forgotten to check in
han,,Not likely. Are the speeders ready?,INT. HOTH - REBEL BASE - MAIN ICE TUNNEL,,5,not likely are the speeders ready
deck officer,,Not yet. We're having some trouble adapting them to the cold.,INT. HOTH - REBEL BASE - MAIN ICE TUNNEL,,5,not yet were having some trouble adapting them to the cold
han,,Then we'll have to go out on Tauntauns.,INT. HOTH - REBEL BASE - MAIN ICE TUNNEL,,5,then well have to go out on tauntauns
deck officer,,"Sir, the temperature's dropping too rapidly.",INT. HOTH - REBEL BASE - MAIN ICE TUNNEL,,5,sir the temperatures dropping too rapidly
han,,That's right. And my friends out in it.,INT. HOTH - REBEL BASE - MAIN ICE TUNNEL,,5,thats right and my friends out in it
assistant officer,,I'll cover sector twelve. Have com-control set screen alpha.,INT. HOTH - REBEL BASE - MAIN ICE TUNNEL,,5,ill cover sector twelve have comcontrol set screen alpha
deck officer,,Your Tauntaun'll freeze before you reach the first marker.,INT. HOTH - REBEL BASE - MAIN ICE TUNNEL,,5,your tauntaunll freeze before you reach the first marker
han,,Then I'll see you in hell!,INT. HOTH - REBEL BASE - MAIN ICE TUNNEL,,5,then ill see you in hell
threepio,,"You must come along now, ARTOO. There's really nothing more we can do. And my joints are freezing up.",INT. HOTH - REBEL BASE - MAIN ICE TUNNEL,,5,you must come along now artoo theres really nothing more we can do and my joints are freezing up
threepio,,"Don't say thing like that! Of course we'll see Master Luke again. He'll be quite all right, you'll see. (to himself) Stupid little short-circuit. He'll be quite all right.",INT. HOTH - REBEL BASE - MAIN ICE TUNNEL,,5,dont say thing like that of course well see master luke again hell be quite all right youll see to himself stupid little shortcircuit hell be quite all right
lieutenant,,"Sir, all the patrols are in. There's still no contact from Skywalker or Solo.",INT. HOTH - REBEL BASE - MAIN ICE TUNNEL,,5,sir all the patrols are in theres still no contact from skywalker or solo
threepio,,"Mistress Leia, ARTOO says he's been quite unable to pick up any signals, although he does admit that his own range is far too weak to abandon all hope.",INT. HOTH - REBEL BASE - MAIN ICE TUNNEL,,5,mistress leia artoo says hes been quite unable to pick up any signals although he does admit that his own range is far too weak to abandon all hope
derlin,,"Your Highness, there's nothing more we can do tonight. The shield doors must be closed.",INT. HOTH - REBEL BASE - MAIN ICE TUNNEL,,5,your highness theres nothing more we can do tonight the shield doors must be closed
derlin,,Close the doors.,INT. HOTH - REBEL BASE - MAIN ICE TUNNEL,,5,close the doors
lieutenant,,"Yes, sir.",INT. HOTH - REBEL BASE - MAIN ICE TUNNEL,,5,yes sir
threepio,,ARTOO says the chances of survival are seven hundred seventy-five...to one.,INT. HOTH - REBEL BASE - MAIN ICE TUNNEL,,5,artoo says the chances of survival are seven hundred seventyfiveto one
threepio,,"Actually, ARTOO has been known to make mistakes... from time to time. Oh, dear, oh, dear. Don't worry about Master Luke. I'm sure he'll be all right. He's quite clever, you know... for a human being.",INT. HOTH - REBEL BASE - MAIN ICE TUNNEL,,5,actually artoo has been known to make mistakes from time to time oh dear oh dear dont worry about master luke im sure hell be all right hes quite clever you know for a human being
obi-wan,,Luke... Luke.,EXT. HOTH - SNOW DRIFT - DUSK,,5,luke luke
luke,,(weakly) Ben?,EXT. HOTH - SNOW DRIFT - DUSK,,5,weakly ben
obi-wan,,You will go to the Dagobah system.,EXT. HOTH - SNOW DRIFT - DUSK,,5,you will go to the dagobah system
luke,,Dagobah system?,EXT. HOTH - SNOW DRIFT - DUSK,,5,dagobah system
obi-wan,,"There you will learn from Yoda, the Jedi Master who instructed me.",EXT. HOTH - SNOW DRIFT - DUSK,,5,there you will learn from yoda the jedi master who instructed me
luke,,(groaning faintly) Ben... Ben.,EXT. HOTH - SNOW DRIFT - DUSK,,5,groaning faintly ben ben
han,,"Luke! Luke! Don't do this, Luke. Come on, give me a sign here.",EXT. HOTH - SNOW DRIFT - DUSK,,5,luke luke dont do this luke come on give me a sign here
han,,Not much time.,EXT. HOTH - SNOW DRIFT - DUSK,,5,not much time
luke,,(moaning) Ben... Ben...,EXT. HOTH - SNOW DRIFT - DUSK,,5,moaning ben ben
han,,"Hang on, kid.",EXT. HOTH - SNOW DRIFT - DUSK,,5,hang on kid
luke,,Dagobah system...,EXT. HOTH - SNOW DRIFT - DUSK,,5,dagobah system
han,,(reeling from the odor) Whew...,EXT. HOTH - SNOW DRIFT - DUSK,,5,reeling from the odor whew
luke,,Dagobah...,EXT. HOTH - SNOW DRIFT - DUSK,,5,dagobah
han,,"This may smell bad, kid...",EXT. HOTH - SNOW DRIFT - DUSK,,5,this may smell bad kid
luke,,(moaning) Yoda...,EXT. HOTH - SNOW DRIFT - DUSK,,5,moaning yoda
han,,...but it will keep you warm... til I get the shelter built. (struggling to get Luke inside the carcass) Ooh... I thought they smelled bad on the outside!,EXT. HOTH - SNOW DRIFT - DUSK,,5,but it will keep you warm til i get the shelter built struggling to get luke inside the carcass ooh i thought they smelled bad on the outside
