from,to,text,where,time,movie_num,text_processed
obi-wan,,"(nodding) According to my information, it should be in this quadrant somewhere... just south of the Rishi Maze.","INT. JEDI TEMPLE, ARCHIVES LIBRARY - DAY",,2,nodding according to my information it should be in this quadrant somewhere just south of the rishi maze
jocasta nu,,No co-ordinates? It sounds like the kind of directions you'd get from a street tout... some old miner or Furbog trader.,"INT. JEDI TEMPLE, ARCHIVES LIBRARY - DAY",,2,no coordinates it sounds like the kind of directions youd get from a street tout some old miner or furbog trader
obi-wan,,All three actually.,"INT. JEDI TEMPLE, ARCHIVES LIBRARY - DAY",,2,all three actually
jocasta nu,,Are you sure it exists?,"INT. JEDI TEMPLE, ARCHIVES LIBRARY - DAY",,2,are you sure it exists
obi-wan,,Absolutely.,"INT. JEDI TEMPLE, ARCHIVES LIBRARY - DAY",,2,absolutely
jocasta nu,,Let me do a gravitational scan.,"INT. JEDI TEMPLE, ARCHIVES LIBRARY - DAY",,2,let me do a gravitational scan
jocasta nu,,There are some inconsistencies here. Maybe the planet you're looking for was destroyed.,"INT. JEDI TEMPLE, ARCHIVES LIBRARY - DAY",,2,there are some inconsistencies here maybe the planet youre looking for was destroyed
obi-wan,,Wouldn't that be on record?,"INT. JEDI TEMPLE, ARCHIVES LIBRARY - DAY",,2,wouldnt that be on record
jocasta nu,,"It ought to be. Unless it was very recent. (shakes her head) I hate to say it, but it looks like the system you're searching for doesn't exist.","INT. JEDI TEMPLE, ARCHIVES LIBRARY - DAY",,2,it ought to be unless it was very recent shakes her head i hate to say it but it looks like the system youre searching for doesnt exist
obi-wan,,That's impossible... perhaps the archives are incomplete.,"INT. JEDI TEMPLE, ARCHIVES LIBRARY - DAY",,2,thats impossible perhaps the archives are incomplete
jocasta nu,,"The archives are comprehensive and totally secure, my young Jedi. One thing you may be absolutely sure of - if an item does not appear in our records, it does not exist!","INT. JEDI TEMPLE, ARCHIVES LIBRARY - DAY",,2,the archives are comprehensive and totally secure my young jedi one thing you may be absolutely sure of  if an item does not appear in our records it does not exist
padme,,There's my house!,"INT. JEDI TEMPLE, ARCHIVES LIBRARY - DAY",,2,theres my house
padme,,(continuing) What? Don't say you're shy!,"INT. JEDI TEMPLE, ARCHIVES LIBRARY - DAY",,2,continuing what dont say youre shy
anakin,,"(untruthfully) No, but I...","INT. JEDI TEMPLE, ARCHIVES LIBRARY - DAY",,2,untruthfully no but i
ryoo & pooja,,Aunt Padme!! Aunt Padme!!,"INT. JEDI TEMPLE, ARCHIVES LIBRARY - DAY",,2,aunt padme aunt padme
padme,,Ryoo!! Pooja!!,"INT. JEDI TEMPLE, ARCHIVES LIBRARY - DAY",,2,ryoo pooja
padme,,"(continuing) I'm so happy to see you! This is Anakin. Anakin, this is Ryoo, and this is Pooja.","INT. JEDI TEMPLE, ARCHIVES LIBRARY - DAY",,2,continuing im so happy to see you this is anakin anakin this is ryoo and this is pooja
ryoo & pooja,,ARTOO!!!,"INT. JEDI TEMPLE, ARCHIVES LIBRARY - DAY",,2,artoo
sola,,"(over her shoulder) They're eating over at Jev Narran's later, Mom. They just had a snack. They'll be fine.","INT. PADME'S PARENTS' HOUSE, MAIN ROOM - AFTERNOON",,2,over her shoulder theyre eating over at jev narrans later mom they just had a snack theyll be fine
padme,,"Anakin, this is my sister, Sola.","INT. PADME'S PARENTS' HOUSE, MAIN ROOM - AFTERNOON",,2,anakin this is my sister sola
sola,,"Hello, Anakin.","INT. PADME'S PARENTS' HOUSE, MAIN ROOM - AFTERNOON",,2,hello anakin
anakin,,Hello.,"INT. PADME'S PARENTS' HOUSE, MAIN ROOM - AFTERNOON",,2,hello
jobal,,"You're just in time for dinner. I hope you're hungry, Anakin.","INT. PADME'S PARENTS' HOUSE, MAIN ROOM - AFTERNOON",,2,youre just in time for dinner i hope youre hungry anakin
anakin,,A little.,"INT. PADME'S PARENTS' HOUSE, MAIN ROOM - AFTERNOON",,2,a little
padme,,"He's being polite, Mom. We're starving.","INT. PADME'S PARENTS' HOUSE, MAIN ROOM - AFTERNOON",,2,hes being polite mom were starving
ruwee,,"(grinning) You came to the right place at the right time. Sit down, son.","INT. PADME'S PARENTS' HOUSE, MAIN ROOM - AFTERNOON",,2,grinning you came to the right place at the right time sit down son
jobal,,"(to Padme) Honey, it's so good to see you safe. We were so worried.","INT. PADME'S PARENTS' HOUSE, MAIN ROOM - AFTERNOON",,2,to padme honey its so good to see you safe we were so worried
ruwee,,Dear...,"INT. PADME'S PARENTS' HOUSE, MAIN ROOM - AFTERNOON",,2,dear
jobal,,"I know, I know... but I had to say it. Now it's done.","INT. PADME'S PARENTS' HOUSE, MAIN ROOM - AFTERNOON",,2,i know i know but i had to say it now its done
sola,,"Well, this is exciting! Do you know, Anakin, you're the first boyfriend my sister's ever brought home?","INT. PADME'S PARENTS' HOUSE, MAIN ROOM - AFTERNOON",,2,well this is exciting do you know anakin youre the first boyfriend my sisters ever brought home
padme,,(rolls her eyes) Sola!! He isn't my boyfriend! He's a Jedi assigned by the Senate to protect me.,"INT. PADME'S PARENTS' HOUSE, MAIN ROOM - AFTERNOON",,2,rolls her eyes sola he isnt my boyfriend hes a jedi assigned by the senate to protect me
jobal,,"A bodyguard?! Oh, Padme! They didn't tell us it was that serious!","INT. PADME'S PARENTS' HOUSE, MAIN ROOM - AFTERNOON",,2,a bodyguard oh padme they didnt tell us it was that serious
padme,,"It's not, Mom, I promise. (glances at Jobal) Anyway, Anakin's a friend. I've known him for years. Remember that little boy who was with the Jedi during the blockade crisis?","INT. PADME'S PARENTS' HOUSE, MAIN ROOM - AFTERNOON",,2,its not mom i promise glances at jobal anyway anakins a friend ive known him for years remember that little boy who was with the jedi during the blockade crisis
padme,,(continuing) He grew up.,"INT. PADME'S PARENTS' HOUSE, MAIN ROOM - AFTERNOON",,2,continuing he grew up
jobal,,"Honey, when are you going to settle down? Haven't you had enough of that life? I certainly have!","INT. PADME'S PARENTS' HOUSE, MAIN ROOM - AFTERNOON",,2,honey when are you going to settle down havent you had enough of that life i certainly have
padme,,"Mom, I'm not in any danger.","INT. PADME'S PARENTS' HOUSE, MAIN ROOM - AFTERNOON",,2,mom im not in any danger
ruwee,,(to Anakin) Is she?,"INT. PADME'S PARENTS' HOUSE, MAIN ROOM - AFTERNOON",,2,to anakin is she
anakin,,...Yes... I'm afraid she is.,"INT. PADME'S PARENTS' HOUSE, MAIN ROOM - AFTERNOON",,2,yes im afraid she is
padme,,(quickly) But not much.,"INT. PADME'S PARENTS' HOUSE, MAIN ROOM - AFTERNOON",,2,quickly but not much
ruwee,,"Sometimes I wish I'd traveled more... but I must say, I'm happy here.",EXT. PADME'S PARENTS' GARDEN - AFTERNOON,,2,sometimes i wish id traveled more but i must say im happy here
anakin,,Padme tells me you teach at the university?,EXT. PADME'S PARENTS' GARDEN - AFTERNOON,,2,padme tells me you teach at the university
ruwee,,"(nodding) Yes, and before that, I was a builder. I also worked for the Refugee Relief Movement, when I was very young.",EXT. PADME'S PARENTS' GARDEN - AFTERNOON,,2,nodding yes and before that i was a builder i also worked for the refugee relief movement when i was very young
sola,,Why haven't you told us about him?,"INT. PADME'S PARENTS' HOUSE, MAIN ROOM - AFTERNOON",,2,why havent you told us about him
padme,,What's there to talk about? He's just a boy.,"INT. PADME'S PARENTS' HOUSE, MAIN ROOM - AFTERNOON",,2,whats there to talk about hes just a boy
sola,,A boy? Have you seen the way he looks at you?,"INT. PADME'S PARENTS' HOUSE, MAIN ROOM - AFTERNOON",,2,a boy have you seen the way he looks at you
padme,,Sola - stop it!,"INT. PADME'S PARENTS' HOUSE, MAIN ROOM - AFTERNOON",,2,sola  stop it
sola,,"It's obvious he has feelings for you. Are you saying, little baby sister, that you haven't noticed?","INT. PADME'S PARENTS' HOUSE, MAIN ROOM - AFTERNOON",,2,its obvious he has feelings for you are you saying little baby sister that you havent noticed
padme,,"I'm not your baby sister, Sola. Anakin and I are friends... our relationship is strictly professional. (to Jobal) Mom, would you tell her to stop it?","INT. PADME'S PARENTS' HOUSE, MAIN ROOM - AFTERNOON",,2,im not your baby sister sola anakin and i are friends our relationship is strictly professional to jobal mom would you tell her to stop it
sola,,"(laughing) Well, maybe you haven't noticed the way he looks at you. I think you're afraid to.","INT. PADME'S PARENTS' HOUSE, MAIN ROOM - AFTERNOON",,2,laughing well maybe you havent noticed the way he looks at you i think youre afraid to
padme,,Cut it out.,"INT. PADME'S PARENTS' HOUSE, MAIN ROOM - AFTERNOON",,2,cut it out
jobal,,Sola's just concerned... we all are.,"INT. PADME'S PARENTS' HOUSE, MAIN ROOM - AFTERNOON",,2,solas just concerned we all are
padme,,"Oh, Mom, you're impossible. What I'm doing is important.","INT. PADME'S PARENTS' HOUSE, MAIN ROOM - AFTERNOON",,2,oh mom youre impossible what im doing is important
jobal,,"You've done your service, PADME. It's time you had a life of your own. You're missing so much!","INT. PADME'S PARENTS' HOUSE, MAIN ROOM - AFTERNOON",,2,youve done your service padme its time you had a life of your own youre missing so much
ruwee,,"Now tell me, son. How serious is this thing? How much danger is my daughter really in?",EXT. PADME'S PARENTS' GARDEN - AFTERNOON,,2,now tell me son how serious is this thing how much danger is my daughter really in
anakin,,"There have been two attempts on her life. Chances are there'll be more. My Master is tracking down the assassins. I'm sure he'll find out who they are. This situation, won't last long.",EXT. PADME'S PARENTS' GARDEN - AFTERNOON,,2,there have been two attempts on her life chances are therell be more my master is tracking down the assassins im sure hell find out who they are this situation wont last long
ruwee,,I don't want anything to happen to her.,EXT. PADME'S PARENTS' GARDEN - AFTERNOON,,2,i dont want anything to happen to her
anakin,,I don't either.,EXT. PADME'S PARENTS' GARDEN - AFTERNOON,,2,i dont either
padme,,"Don't worry, this won't take long.","INT. PADME'S PARENTS' HOUSE, PADME'S ROOM - AFTERNOON",,2,dont worry this wont take long
anakin,,I just want to get there before dark.,"INT. PADME'S PARENTS' HOUSE, PADME'S ROOM - AFTERNOON",,2,i just want to get there before dark
anakin,,(continuing) You still live at home.,"INT. PADME'S PARENTS' HOUSE, PADME'S ROOM - AFTERNOON",,2,continuing you still live at home
padme,,"I move around so much, I've never had a place of my own. Official residences have no warmth. I feel good here. I feel at home.","INT. PADME'S PARENTS' HOUSE, PADME'S ROOM - AFTERNOON",,2,i move around so much ive never had a place of my own official residences have no warmth i feel good here i feel at home
anakin,,I never had a real home. Home was always where my Mom was.,"INT. PADME'S PARENTS' HOUSE, PADME'S ROOM - AFTERNOON",,2,i never had a real home home was always where my mom was
anakin,,(continuing) Is this you?,"INT. PADME'S PARENTS' HOUSE, PADME'S ROOM - AFTERNOON",,2,continuing is this you
padme,,"That was when I went with the Relief Group to Shadda-Bi-Boran. Their sun was imploding, and the planet was dying. I was helping to relocate the children. See that little one I'm holding? His name was N'a-kee-tula, which means sweethear. He was so full of life,. All those kids were. I did everything I could to save him, but he died... they all did. They were never able to adapt... to live off their native planet.","INT. PADME'S PARENTS' HOUSE, PADME'S ROOM - AFTERNOON",,2,that was when i went with the relief group to shaddabiboran their sun was imploding and the planet was dying i was helping to relocate the children see that little one im holding his name was nakeetula which means sweethear he was so full of life all those kids were i did everything i could to save him but he died they all did they were never able to adapt to live off their native planet
padme,,(continuing) My first day as an Apprentice Legislator. Notice the difference?,"INT. PADME'S PARENTS' HOUSE, PADME'S ROOM - AFTERNOON",,2,continuing my first day as an apprentice legislator notice the difference
yoda,,"Don't think... feel... be as one with the Force. Help you, it will. (he sees Obi-Wan) Younglings - enough! A visitor we have. Welcome him.","INT. JEDI TEMPLE, TRAINING VERANDA - DAY",,2,dont think feel be as one with the force help you it will he sees obiwan younglings  enough a visitor we have welcome him
yoda,,"(continuing) Master Obi-Wan Kenobi, meet the mighty Bear Clan.","INT. JEDI TEMPLE, TRAINING VERANDA - DAY",,2,continuing master obiwan kenobi meet the mighty bear clan
children,,"Welcome, Master Obi-Wan!","INT. JEDI TEMPLE, TRAINING VERANDA - DAY",,2,welcome master obiwan
obi-wan,,"I am sorry to disturb you, Master.","INT. JEDI TEMPLE, TRAINING VERANDA - DAY",,2,i am sorry to disturb you master
yoda,,"What help to you, can I be?","INT. JEDI TEMPLE, TRAINING VERANDA - DAY",,2,what help to you can i be
obi-wan,,Im looking for a planet described to me by an old friend. I trust him. But the system doesnt show up on the archive maps.,"INT. JEDI TEMPLE, TRAINING VERANDA - DAY",,2,im looking for a planet described to me by an old friend i trust him but the system doesnt show up on the archive maps
yoda,,"An interesting puzzle. Gather round the map reader, younglings. Master Obi-Wan has lost a planet. Find it, we will try...","INT. JEDI TEMPLE, TRAINING VERANDA - DAY",,2,an interesting puzzle gather round the map reader younglings master obiwan has lost a planet find it we will try
obi-wan,,This is where it ought to be... but it isnt. Gravity is pulling all the stars in this area inward to this spot. There should be a star here... but there isnt.,"INT. JEDI TEMPLE, TRAINING VERANDA - DAY",,2,this is where it ought to be but it isnt gravity is pulling all the stars in this area inward to this spot there should be a star here but there isnt
yoda,,"Most interesting. Gravitys silhouette remains, but the star and all its planets have disappeared. How can this be?","INT. JEDI TEMPLE, TRAINING VERANDA - DAY",,2,most interesting gravitys silhouette remains but the star and all its planets have disappeared how can this be
jedi child jack,,Because someone erased it from the archive memory.,"INT. JEDI TEMPLE, TRAINING VERANDA - DAY",,2,because someone erased it from the archive memory
children,,Thats right! Yes! Thats what happened! Someone erased it!,"INT. JEDI TEMPLE, TRAINING VERANDA - DAY",,2,thats right yes thats what happened someone erased it
jedi child may,,"If the planet blew up, the gravity would go away.","INT. JEDI TEMPLE, TRAINING VERANDA - DAY",,2,if the planet blew up the gravity would go away
yoda,,"Truly wonderful, the mind of a child is. Uncluttered. To the centre of the pull of gravity go, and find your planet you will.","INT. JEDI TEMPLE, TRAINING VERANDA - DAY",,2,truly wonderful the mind of a child is uncluttered to the centre of the pull of gravity go and find your planet you will
obi-wan,,"But Master Yoda who could have erased information from the archives? Thats impossible, isnt it?","INT. JEDI TEMPLE, TRAINING VERANDA - DAY",,2,but master yoda who could have erased information from the archives thats impossible isnt it
yoda,,"(frowning) Much harder to answer, that question is.","INT. JEDI TEMPLE, TRAINING VERANDA - DAY",,2,frowning much harder to answer that question is
padme,,"When I was in Level Three, we used to come here for school retreat. See that island? We used to swim there every day. I love the water.","EXT. NABOO LAKE RETREAT, LODGE, GARDEN TERRACEM LATE AFTERNOON",,2,when i was in level three we used to come here for school retreat see that island we used to swim there every day i love the water
anakin,,I do too. I guess it comes from growing up on a desert planet.,"EXT. NABOO LAKE RETREAT, LODGE, GARDEN TERRACEM LATE AFTERNOON",,2,i do too i guess it comes from growing up on a desert planet
padme,,...We used to lie on the sand and let the sun dry us... and try to guess the names of the birds singing.,"EXT. NABOO LAKE RETREAT, LODGE, GARDEN TERRACEM LATE AFTERNOON",,2,we used to lie on the sand and let the sun dry us and try to guess the names of the birds singing
anakin,,"I dont like sand. Its coarse and rough and irritating, and it gets everywhere. Not like here. Here everythings soft... and smooth...","EXT. NABOO LAKE RETREAT, LODGE, GARDEN TERRACEM LATE AFTERNOON",,2,i dont like sand its coarse and rough and irritating and it gets everywhere not like here here everythings soft and smooth
padme,,There was a very old man who lived on the island. He used to make glass out of sand - and vases and necklaces out of the glass. They were magical.,"EXT. NABOO LAKE RETREAT, LODGE, GARDEN TERRACEM LATE AFTERNOON",,2,there was a very old man who lived on the island he used to make glass out of sand  and vases and necklaces out of the glass they were magical
anakin,,(looks into her eyes) Everything here is magical.,"EXT. NABOO LAKE RETREAT, LODGE, GARDEN TERRACEM LATE AFTERNOON",,2,looks into her eyes everything here is magical
padme,,You could look into the glass and see the water. The way it ripples and moves. It looked so real... but it wasnt.,"EXT. NABOO LAKE RETREAT, LODGE, GARDEN TERRACEM LATE AFTERNOON",,2,you could look into the glass and see the water the way it ripples and moves it looked so real but it wasnt
anakin,,"Sometimes, when you believe something to be real, it becomes real. Real enough, anyway...","EXT. NABOO LAKE RETREAT, LODGE, GARDEN TERRACEM LATE AFTERNOON",,2,sometimes when you believe something to be real it becomes real real enough anyway
padme,,"I used to think if you looked too deeply into glass, you would lose yourself.","EXT. NABOO LAKE RETREAT, LODGE, GARDEN TERRACEM LATE AFTERNOON",,2,i used to think if you looked too deeply into glass you would lose yourself
anakin,,I think it's true...,"EXT. NABOO LAKE RETREAT, LODGE, GARDEN TERRACEM LATE AFTERNOON",,2,i think its true
padme,,I shouldn't have done that.,"EXT. NABOO LAKE RETREAT, LODGE, GARDEN TERRACEM LATE AFTERNOON",,2,i shouldnt have done that
anakin,,"I'm sorry. When I'm around you, my mind is no longer my own.","EXT. NABOO LAKE RETREAT, LODGE, GARDEN TERRACEM LATE AFTERNOON",,2,im sorry when im around you my mind is no longer my own
padme,,It's the situation... the stress...,"EXT. NABOO LAKE RETREAT, LODGE, GARDEN TERRACEM LATE AFTERNOON",,2,its the situation the stress
anakin,,...the view.,"EXT. NABOO LAKE RETREAT, LODGE, GARDEN TERRACEM LATE AFTERNOON",,2,the view
mace windu,,"Be wary, this disturbance in the Force is growing stronger.","EXT. CORUSCANT, LANDING PLATFORM - LATE AFTERNOON",,2,be wary this disturbance in the force is growing stronger
obi-wan,,I am concerned for my Padawan. He is not ready to be on his own.,"EXT. CORUSCANT, LANDING PLATFORM - LATE AFTERNOON",,2,i am concerned for my padawan he is not ready to be on his own
yoda,,"The Council is confident in this decision, Obi-Wan.","EXT. CORUSCANT, LANDING PLATFORM - LATE AFTERNOON",,2,the council is confident in this decision obiwan
mace windu,,"He has exceptional skills. The Council is confident in its decision, Obi-Wan. If the prophecy is true, he weill be the one to bring balance to the Force.","EXT. CORUSCANT, LANDING PLATFORM - LATE AFTERNOON",,2,he has exceptional skills the council is confident in its decision obiwan if the prophecy is true he weill be the one to bring balance to the force
obi-wan,,But he still has much to learn. And his abilities have made him... well... arrogant. I realise now what you and Master Yoda knew from the beginning... the boy was too old to start the training and...,"EXT. CORUSCANT, LANDING PLATFORM - LATE AFTERNOON",,2,but he still has much to learn and his abilities have made him well arrogant i realise now what you and master yoda knew from the beginning the boy was too old to start the training and
mace windu,,There's something else?,"EXT. CORUSCANT, LANDING PLATFORM - LATE AFTERNOON",,2,theres something else
obi-wan,,"Master, he should not have been given this assignment. I'm afraid Anakin won't be able to protect the Senator.","EXT. CORUSCANT, LANDING PLATFORM - LATE AFTERNOON",,2,master he should not have been given this assignment im afraid anakin wont be able to protect the senator
mace windu,,Why?,"EXT. CORUSCANT, LANDING PLATFORM - LATE AFTERNOON",,2,why
obi-wan,,He has a... an emotional connection with her. It's been there since he was boy. Now he's confused... distracted.,"EXT. CORUSCANT, LANDING PLATFORM - LATE AFTERNOON",,2,he has a an emotional connection with her its been there since he was boy now hes confused distracted
mace windu,,"Obi-Wan, you must have faith that he will take the right path.","EXT. CORUSCANT, LANDING PLATFORM - LATE AFTERNOON",,2,obiwan you must have faith that he will take the right path
obi-wan,,Has Master Yoda gained any insight into whether or not this war will come about?,"EXT. CORUSCANT, LANDING PLATFORM - LATE AFTERNOON",,2,has master yoda gained any insight into whether or not this war will come about
mace windu,,Probing the Dark Side is a dangerous process. He could be in seclusion for days... May the force be with you.,"EXT. CORUSCANT, LANDING PLATFORM - LATE AFTERNOON",,2,probing the dark side is a dangerous process he could be in seclusion for days may the force be with you
padme,,You did that?,"INT. NABOO LAKE RETREAT, DINING ROOM - LATE AFTERNOON",,2,you did that
anakin,,What?,"INT. NABOO LAKE RETREAT, DINING ROOM - LATE AFTERNOON",,2,what
padme,,That! Now stop it!,"INT. NABOO LAKE RETREAT, DINING ROOM - LATE AFTERNOON",,2,that now stop it
padme,,(continuing) Anakin!!,"INT. NABOO LAKE RETREAT, DINING ROOM - LATE AFTERNOON",,2,continuing anakin
anakin,,"I'm not really supposed to do that... for fun, I mean. If Master Obi-Wan were here, he'd be very grumpy.","INT. NABOO LAKE RETREAT, DINING ROOM - LATE AFTERNOON",,2,im not really supposed to do that for fun i mean if master obiwan were here hed be very grumpy
anakin,,May I tell you something?,"INT. NABOO LAKE RETREAT, LODGE, FIREPLACE ALCOVE - TWILIGHT",,2,may i tell you something
padme,,I don't know.,"INT. NABOO LAKE RETREAT, LODGE, FIREPLACE ALCOVE - TWILIGHT",,2,i dont know
anakin,,Then how can I tell you?,"INT. NABOO LAKE RETREAT, LODGE, FIREPLACE ALCOVE - TWILIGHT",,2,then how can i tell you
padme,,Maybe you should use your Jedi intuition.,"INT. NABOO LAKE RETREAT, LODGE, FIREPLACE ALCOVE - TWILIGHT",,2,maybe you should use your jedi intuition
anakin,,It doesn't work around you. My mind is always a muddle... I can only think of you.,"INT. NABOO LAKE RETREAT, LODGE, FIREPLACE ALCOVE - TWILIGHT",,2,it doesnt work around you my mind is always a muddle i can only think of you
padme,,"Anakin, don't...","INT. NABOO LAKE RETREAT, LODGE, FIREPLACE ALCOVE - TWILIGHT",,2,anakin dont
anakin,,"From the moment I met you, all those years ago, a day hasn't gone by when I haven't thought of you. And now that I'm close to you again, I'm in agony. The closer I get to you, the worse it gets. The thought of not being with you mskes my stomach turn over - my mouth goes dry. I feel dizzy. I can't breathe. I'm haunted by the kiss you should never have given me. My heart is beating, hoping that kiss will not become a scar. You are in my very soul, tormenting me. What can I do? I will do anything you ask...","INT. NABOO LAKE RETREAT, LODGE, FIREPLACE ALCOVE - TWILIGHT",,2,from the moment i met you all those years ago a day hasnt gone by when i havent thought of you and now that im close to you again im in agony the closer i get to you the worse it gets the thought of not being with you mskes my stomach turn over  my mouth goes dry i feel dizzy i cant breathe im haunted by the kiss you should never have given me my heart is beating hoping that kiss will not become a scar you are in my very soul tormenting me what can i do i will do anything you ask
anakin,,"(continuing) If you are suffering as much as I am, tell me.","INT. NABOO LAKE RETREAT, LODGE, FIREPLACE ALCOVE - TWILIGHT",,2,continuing if you are suffering as much as i am tell me
padme,,...I can't. We can't. It's just not possible.,"INT. NABOO LAKE RETREAT, LODGE, FIREPLACE ALCOVE - TWILIGHT",,2,i cant we cant its just not possible
anakin,,"Anything's possible. Padme, please listen...","INT. NABOO LAKE RETREAT, LODGE, FIREPLACE ALCOVE - TWILIGHT",,2,anythings possible padme please listen
padme,,"You listen. We live in a real world. Come back to it. You're studying to become a Jedi Knight. I'm a Senator. If you follow your thoughts through to conclusion, they will take us to a place we cannot go... regardless of the way we feel about each other.","INT. NABOO LAKE RETREAT, LODGE, FIREPLACE ALCOVE - TWILIGHT",,2,you listen we live in a real world come back to it youre studying to become a jedi knight im a senator if you follow your thoughts through to conclusion they will take us to a place we cannot go regardless of the way we feel about each other
anakin,,Then you do feel something! There's an extraordinary connection between us. You can't deny that.,"INT. NABOO LAKE RETREAT, LODGE, FIREPLACE ALCOVE - TWILIGHT",,2,then you do feel something theres an extraordinary connection between us you cant deny that
padme,,"Annie, it doesn't make any difference. Jedi aren't allowed to marry. You swore an oath, remember? You'd be expelled from the Order. I will not let you give up your responsibilities... your future, for me.","INT. NABOO LAKE RETREAT, LODGE, FIREPLACE ALCOVE - TWILIGHT",,2,annie it doesnt make any difference jedi arent allowed to marry you swore an oath remember youd be expelled from the order i will not let you give up your responsibilities your future for me
