from,to,text,where,time,movie_num,text_processed
anakin,,I will quickly discover the truth of all this.,118 INT. CORUSCANT-CHANCELLOR'S OFFICE-EARLY EVENING,,3,i will quickly discover the truth of all this
palpatine,,"You have great wisdom, Anakin. Know the power of the dark side. The power to save Padme.",118 INT. CORUSCANT-CHANCELLOR'S OFFICE-EARLY EVENING,,3,you have great wisdom anakin know the power of the dark side the power to save padme
palpatine,,(continuing) I am not going anywhere. You have time to decide my fate. Perhaps you'll reconsider and help me rule the galaxy for the good of all...,118 INT. CORUSCANT-CHANCELLOR'S OFFICE-EARLY EVENING,,3,continuing i am not going anywhere you have time to decide my fate perhaps youll reconsider and help me rule the galaxy for the good of all
general grievous,,Prepare to move out of orbit. I will be up in a few moments.,121 EXT. UTAPAU-WINDMILLS-DAY,,3,prepare to move out of orbit i will be up in a few moments
obi-wan,,So uncivilized...,123 EXT. UTAPAU-SECRET LANDING PLATFORM-DAY,,3,so uncivilized
anakin,,"Master Windu, I must talk to you.",124 INT. JEDI GUNSHIP-LANDING PLATFORM-EARLY EVENING,,3,master windu i must talk to you
mace windu,,"What is it, Skywalker? We are in a hurry. We have just received word that Obi-Wan has destroyed General Grievous. We are on our way to make sure the Chancellor returns emergency powers back to the Senate.",124 INT. JEDI GUNSHIP-LANDING PLATFORM-EARLY EVENING,,3,what is it skywalker we are in a hurry we have just received word that obiwan has destroyed general grievous we are on our way to make sure the chancellor returns emergency powers back to the senate
anakin,,He won't give up his power. I've just learned a terrible truth. I think Chancellor Palpatine is a Sith Lord.,124 INT. JEDI GUNSHIP-LANDING PLATFORM-EARLY EVENING,,3,he wont give up his power ive just learned a terrible truth i think chancellor palpatine is a sith lord
mace windu,,A Sith Lord?,124 INT. JEDI GUNSHIP-LANDING PLATFORM-EARLY EVENING,,3,a sith lord
anakin,,Yes. The one we have been looking for.,124 INT. JEDI GUNSHIP-LANDING PLATFORM-EARLY EVENING,,3,yes the one we have been looking for
mace windu,,How do you know this?,124 INT. JEDI GUNSHIP-LANDING PLATFORM-EARLY EVENING,,3,how do you know this
anakin,,He knows the ways of the Force. He has been trained to use the dark side.,124 INT. JEDI GUNSHIP-LANDING PLATFORM-EARLY EVENING,,3,he knows the ways of the force he has been trained to use the dark side
mace windu,,Are you sure?,124 INT. JEDI GUNSHIP-LANDING PLATFORM-EARLY EVENING,,3,are you sure
anakin,,Absolutely.,124 INT. JEDI GUNSHIP-LANDING PLATFORM-EARLY EVENING,,3,absolutely
mace windu,,Then our worst fears have been realized. We must move quickly if the Jedi Order is to survive.,124 INT. JEDI GUNSHIP-LANDING PLATFORM-EARLY EVENING,,3,then our worst fears have been realized we must move quickly if the jedi order is to survive
anakin,,"Master, the Chancellor is very powerful. You will need my help if you are going to arrest him.",124 INT. JEDI GUNSHIP-LANDING PLATFORM-EARLY EVENING,,3,master the chancellor is very powerful you will need my help if you are going to arrest him
mace windu,,"For your own good, stay out of this affair. I sense a great deal of confusion in you, young Skywalker. There is much fear that clouds your judgment.",124 INT. JEDI GUNSHIP-LANDING PLATFORM-EARLY EVENING,,3,for your own good stay out of this affair i sense a great deal of confusion in you young skywalker there is much fear that clouds your judgment
anakin,,"I must go, Master.",124 INT. JEDI GUNSHIP-LANDING PLATFORM-EARLY EVENING,,3,i must go master
mace windu,,"No. If what you told me is true, you will have gained my trust, but for now remain here.",124 INT. JEDI GUNSHIP-LANDING PLATFORM-EARLY EVENING,,3,no if what you told me is true you will have gained my trust but for now remain here
anakin,,"Yes, Master.",124 INT. JEDI GUNSHIP-LANDING PLATFORM-EARLY EVENING,,3,yes master
mace windu,,Wait for us in the Council Chamber until we return.,124 INT. JEDI GUNSHIP-LANDING PLATFORM-EARLY EVENING,,3,wait for us in the council chamber until we return
anakin,,"Yes, Master.",124 INT. JEDI GUNSHIP-LANDING PLATFORM-EARLY EVENING,,3,yes master
palpatine,,"(V.O.) You do know, don't you, if the Jedi destroy me, any chance of saving her will be lost.",125 INT. CORUSCANT-JEDI COUNCIL/PADME'S APARTMENT-EARLY EVENING,,3,vo you do know dont you if the jedi destroy me any chance of saving her will be lost
padme,,"I truly, deeply love you. Before I die. I want you to know.",125 INT. CORUSCANT-JEDI COUNCIL/PADME'S APARTMENT-EARLY EVENING,,3,i truly deeply love you before i die i want you to know
c-3po,,"My Lady, are you... . Are you all right?",125 INT. CORUSCANT-JEDI COUNCIL/PADME'S APARTMENT-EARLY EVENING,,3,my lady are you  are you all right
anakin,,I can't do this... I can't let her die.,125 INT. CORUSCANT-JEDI COUNCIL/PADME'S APARTMENT-EARLY EVENING,,3,i cant do this i cant let her die
palpatine,,"Master Windu. I take it General Grievous has been destroyed then. I must say, you're here sooner than expected.",128 INT. CORUSCANT-CHANCELLORS OFFICE-EARLY EVENING,,3,master windu i take it general grievous has been destroyed then i must say youre here sooner than expected
mace windu,,"In the name of the Galactic Senate of the Republic, you are under arrest, Chancellor.",128 INT. CORUSCANT-CHANCELLORS OFFICE-EARLY EVENING,,3,in the name of the galactic senate of the republic you are under arrest chancellor
palpatine,,"Are you threatening me, Master Jedi?",128 INT. CORUSCANT-CHANCELLORS OFFICE-EARLY EVENING,,3,are you threatening me master jedi
mace windu,,The Senate will decide your fate.,128 INT. CORUSCANT-CHANCELLORS OFFICE-EARLY EVENING,,3,the senate will decide your fate
palpatine,,(burst of anger) I am the Senate!,128 INT. CORUSCANT-CHANCELLORS OFFICE-EARLY EVENING,,3,burst of anger i am the senate
mace windu,,Not yet!,128 INT. CORUSCANT-CHANCELLORS OFFICE-EARLY EVENING,,3,not yet
palpatine,,"It's treason, then.",128 INT. CORUSCANT-CHANCELLORS OFFICE-EARLY EVENING,,3,its treason then
mace windu,,"You are under arrest, My Lord.",128 INT. CORUSCANT-CHANCELLORS OFFICE-EARLY EVENING,,3,you are under arrest my lord
palpatine,,Anakin! I told you it would come to this. I was right. The Jedi are taking over.,128 INT. CORUSCANT-CHANCELLORS OFFICE-EARLY EVENING,,3,anakin i told you it would come to this i was right the jedi are taking over
mace windu,,You old fool. The oppression of the Sith will never return. Your plot to regain control of the Republic is over... you have lost...,128 INT. CORUSCANT-CHANCELLORS OFFICE-EARLY EVENING,,3,you old fool the oppression of the sith will never return your plot to regain control of the republic is over you have lost
palpatine,,No! No! You will die!,128 INT. CORUSCANT-CHANCELLORS OFFICE-EARLY EVENING,,3,no no you will die
palpatine,,"He is a traitor, Anakin.",128 INT. CORUSCANT-CHANCELLORS OFFICE-EARLY EVENING,,3,he is a traitor anakin
mace windu,,He's the traitor. Stop him!,128 INT. CORUSCANT-CHANCELLORS OFFICE-EARLY EVENING,,3,hes the traitor stop him
palpatine,,"Come to your senses, boy. The Jedi are in revolt. They will betray you, just as they betrayed me.",128 INT. CORUSCANT-CHANCELLORS OFFICE-EARLY EVENING,,3,come to your senses boy the jedi are in revolt they will betray you just as they betrayed me
mace windu,,Aarrrrggghhhhh...,128 INT. CORUSCANT-CHANCELLORS OFFICE-EARLY EVENING,,3,aarrrrggghhhhh
palpatine,,"You are not one of them, Anakin. Don't let him kill me.",128 INT. CORUSCANT-CHANCELLORS OFFICE-EARLY EVENING,,3,you are not one of them anakin dont let him kill me
mace windu,,Aarrrrggghhhhh...,128 INT. CORUSCANT-CHANCELLORS OFFICE-EARLY EVENING,,3,aarrrrggghhhhh
palpatine,,I am your pathway to power. I have the power to save the one you love. You must choose. You must stop him.,128 INT. CORUSCANT-CHANCELLORS OFFICE-EARLY EVENING,,3,i am your pathway to power i have the power to save the one you love you must choose you must stop him
mace windu,,"Don't listen to him, Anakin.",128 INT. CORUSCANT-CHANCELLORS OFFICE-EARLY EVENING,,3,dont listen to him anakin
palpatine,,Help me! Don't let him kill me. I can't hold on any longer. Ahhhhhhh... ahhhhhhh... ahhhhhhh...,128 INT. CORUSCANT-CHANCELLORS OFFICE-EARLY EVENING,,3,help me dont let him kill me i cant hold on any longer ahhhhhhh ahhhhhhh ahhhhhhh
palpatine,,I can't... I give up. Help me. I am weak... I am too weak. Don't kill me. I give up. I'm dying. I can't hold on any longer.,128 INT. CORUSCANT-CHANCELLORS OFFICE-EARLY EVENING,,3,i cant i give up help me i am weak i am too weak dont kill me i give up im dying i cant hold on any longer
mace windu,,You Sith disease. I am going to end this once and for all.,128 INT. CORUSCANT-CHANCELLORS OFFICE-EARLY EVENING,,3,you sith disease i am going to end this once and for all
anakin,,"You can't kill him, Master. He must stand trial.",128 INT. CORUSCANT-CHANCELLORS OFFICE-EARLY EVENING,,3,you cant kill him master he must stand trial
mace windu,,He has too much control of the Senate and the Courts. He is too dangerous to be kept alive.,128 INT. CORUSCANT-CHANCELLORS OFFICE-EARLY EVENING,,3,he has too much control of the senate and the courts he is too dangerous to be kept alive
palpatine,,I'm too weak. Don't kill me. Please.,128 INT. CORUSCANT-CHANCELLORS OFFICE-EARLY EVENING,,3,im too weak dont kill me please
anakin,,It is not the Jedi way...,128 INT. CORUSCANT-CHANCELLORS OFFICE-EARLY EVENING,,3,it is not the jedi way
anakin,,(continuing) He must live...,128 INT. CORUSCANT-CHANCELLORS OFFICE-EARLY EVENING,,3,continuing he must live
palpatine,,"Please don't, please don't...",128 INT. CORUSCANT-CHANCELLORS OFFICE-EARLY EVENING,,3,please dont please dont
anakin,,I need him...,128 INT. CORUSCANT-CHANCELLORS OFFICE-EARLY EVENING,,3,i need him
palpatine,,Please don't...,128 INT. CORUSCANT-CHANCELLORS OFFICE-EARLY EVENING,,3,please dont
anakin,,NO!!!,128 INT. CORUSCANT-CHANCELLORS OFFICE-EARLY EVENING,,3,no
palpatine,,Power! Unlimited power!,128 INT. CORUSCANT-CHANCELLORS OFFICE-EARLY EVENING,,3,power unlimited power
anakin,,What have I done?,128 INT. CORUSCANT-CHANCELLORS OFFICE-EARLY EVENING,,3,what have i done
palpatine,,"You are fulfilling your destin, Anakin. Become my apprentice. Learn to use the dark side of the Force.",128 INT. CORUSCANT-CHANCELLORS OFFICE-EARLY EVENING,,3,you are fulfilling your destin anakin become my apprentice learn to use the dark side of the force
anakin,,I will do whatever you ask.,128 INT. CORUSCANT-CHANCELLORS OFFICE-EARLY EVENING,,3,i will do whatever you ask
palpatine,,Good.,128 INT. CORUSCANT-CHANCELLORS OFFICE-EARLY EVENING,,3,good
anakin,,Just help me save Padme's life. I can't live without her. I won't let her die. I want the power to stop death.,128 INT. CORUSCANT-CHANCELLORS OFFICE-EARLY EVENING,,3,just help me save padmes life i cant live without her i wont let her die i want the power to stop death
palpatine,,"To cheat death is a power only one has achieved, but if we work together, I know we can discover the secret.",128 INT. CORUSCANT-CHANCELLORS OFFICE-EARLY EVENING,,3,to cheat death is a power only one has achieved but if we work together i know we can discover the secret
anakin,,I pledge myself to your teachings. To the ways of the Sith.,128 INT. CORUSCANT-CHANCELLORS OFFICE-EARLY EVENING,,3,i pledge myself to your teachings to the ways of the sith
palpatine,,"Good. Good. The Force is strong with you. A powerful Sith you will become. Henceforth, you shall be known as Darth... Vader.",128 INT. CORUSCANT-CHANCELLORS OFFICE-EARLY EVENING,,3,good good the force is strong with you a powerful sith you will become henceforth you shall be known as darth vader
anakin,,Thank you. my Master.,128 INT. CORUSCANT-CHANCELLORS OFFICE-EARLY EVENING,,3,thank you my master
palpatine,,"Rise, Darth Vader.",128 INT. CORUSCANT-CHANCELLORS OFFICE-EARLY EVENING,,3,rise darth vader
palpatine,,"Because the Council did not trust you, my young apprentice, I believe you are the only Jedi with no knowledge of this plot. When the Jedi learn what has transpired here, they will kill us, along with all the Senators.",130 INT. CORUSCANT-CHANCELLOR'S OFFICE-EVENING,,3,because the council did not trust you my young apprentice i believe you are the only jedi with no knowledge of this plot when the jedi learn what has transpired here they will kill us along with all the senators
anakin,,I agree. The Jedi's next move will be against the Senate.,130 INT. CORUSCANT-CHANCELLOR'S OFFICE-EVENING,,3,i agree the jedis next move will be against the senate
palpatine,,"Every single Jedi, including your friend Obi-Wan Kenobi, is now an enemy of the Republic. You understand that, don't you?",130 INT. CORUSCANT-CHANCELLOR'S OFFICE-EVENING,,3,every single jedi including your friend obiwan kenobi is now an enemy of the republic you understand that dont you
anakin,,"I understand, Master.",130 INT. CORUSCANT-CHANCELLOR'S OFFICE-EVENING,,3,i understand master
palpatine,,"We must move quickly. The Jedi are relentless; if they are not all destroyed, it will be civil war without end. First, I want you to go to the Jedi Temple. We will catch them off balance. Do what must be done, Lord Vader. Do not hesitate. Show no mercy. Only then will you be strong enough with the dark side to save Padme.",130 INT. CORUSCANT-CHANCELLOR'S OFFICE-EVENING,,3,we must move quickly the jedi are relentless if they are not all destroyed it will be civil war without end first i want you to go to the jedi temple we will catch them off balance do what must be done lord vader do not hesitate show no mercy only then will you be strong enough with the dark side to save padme
anakin,,What about the other Jedi spread across the galaxy?,130 INT. CORUSCANT-CHANCELLOR'S OFFICE-EVENING,,3,what about the other jedi spread across the galaxy
palpatine,,"Their betrayal will be dealt with. After you have killed all the Jedi in the Temple, go to the Mustafar system. Wipe out Viceroy Gunray and the other Separatist leaders. Once more, the Sith will rule the galaxy, and we shall have peace.",130 INT. CORUSCANT-CHANCELLOR'S OFFICE-EVENING,,3,their betrayal will be dealt with after you have killed all the jedi in the temple go to the mustafar system wipe out viceroy gunray and the other separatist leaders once more the sith will rule the galaxy and we shall have peace
obi-wan,,"Commander, contact your troops. Tell them to move to the higher levels.",132 EXT. UTAPAU-TENTH LEVEL-LANDIXG PLATFORM-DAY,,3,commander contact your troops tell them to move to the higher levels
clone commander cody,,"Very good, sir.",132 EXT. UTAPAU-TENTH LEVEL-LANDIXG PLATFORM-DAY,,3,very good sir
clone commander cody,,"(continuing) Oh, by the way, I think you'll be needing this.",132 EXT. UTAPAU-TENTH LEVEL-LANDIXG PLATFORM-DAY,,3,continuing oh by the way i think youll be needing this
obi-wan,,"Thank you, Cody, (smiling) Now let's get a move on. We've got a battle to win here.",132 EXT. UTAPAU-TENTH LEVEL-LANDIXG PLATFORM-DAY,,3,thank you cody smiling now lets get a move on weve got a battle to win here
clone commander cody,,"Yes, sir!",132 EXT. UTAPAU-TENTH LEVEL-LANDIXG PLATFORM-DAY,,3,yes sir
darth sldious,,"Commander Cody, the time has come. Execute Order Sixty-Six.",132 EXT. UTAPAU-TENTH LEVEL-LANDIXG PLATFORM-DAY,,3,commander cody the time has come execute order sixtysix
clone commander cody,,"It will be done, My Lord.",132 EXT. UTAPAU-TENTH LEVEL-LANDIXG PLATFORM-DAY,,3,it will be done my lord
clone commander cody,,Blast him!,132 EXT. UTAPAU-TENTH LEVEL-LANDIXG PLATFORM-DAY,,3,blast him
darth sldious,,Commander 1138...,133 EXT. MYGEETO-DAWN,,3,commander 
clone commander bacara,,"Yes, sir.",133 EXT. MYGEETO-DAWN,,3,yes sir
darth sldious,,The time has come. Execute Order Sixty-Six.,133 EXT. MYGEETO-DAWN,,3,the time has come execute order sixtysix
clone commander bacara,,"It will be done, My Lord.",133 EXT. MYGEETO-DAWN,,3,it will be done my lord
aayla,,Steady... . steady...,134 EXT. FELUCIA-FOREST-DAY,,3,steady  steady
aayla,,"(continuing) Bly, do you think they're Droids?",134 EXT. FELUCIA-FOREST-DAY,,3,continuing bly do you think theyre droids
bly,,No.,134 EXT. FELUCIA-FOREST-DAY,,3,no
darth sidious,,Execute Order Sixty-Six.,137 INT. CATO NEIMOIDIA-COCKPIT CLONE FIGHTER-DAY,,3,execute order sixtysix
clone pilot,,"It will be done, My Lord.",137 INT. CATO NEIMOIDIA-COCKPIT CLONE FIGHTER-DAY,,3,it will be done my lord
plo koon,,There they are. Land on the nearest platform.,138 INT. CATO NEIMOIDIA-JEDI STARFIGHTER-DAY,,3,there they are land on the nearest platform
clone commander gree,,"Yes, My Lord.",141 INT. CORUSCANT-CHANCELLOR'S OFFICE-NIGHT,,3,yes my lord
darth sidious,,The time has come. Execute Order Sixty-Six.,141 INT. CORUSCANT-CHANCELLOR'S OFFICE-NIGHT,,3,the time has come execute order sixtysix
clone commander gree,,"It will be done, My Lord.",142 EXT. KASHYYYK-MEETING HALL BALCONY-DAY,,3,it will be done my lord
younglings,,"Master Skywalker, there are too many of them. What are we going to do?",145 INT. CORUSCANT-JEDI TEMPLE-BATTLE-NIGHT,,3,master skywalker there are too many of them what are we going to do
c-3po,,"The Chancellor's office indicated Master Anakin returned to the Jedi Temple. Don't worry, My Lady. I am sure he will be all right.",146 INT. CORUSCANT-PADME'S APARTMENT-PRE-DAWN,,3,the chancellors office indicated master anakin returned to the jedi temple dont worry my lady i am sure he will be all right
bail organa,,What's going on here?!?,148 EXT. CORUSCANT-JEDI TEMPLE-LANDING PLATFORM-PRE-DAWN,,3,whats going on here
clone sergeant,,"There's been a rebellion. Don't worry, sir, the situation is under control.",148 EXT. CORUSCANT-JEDI TEMPLE-LANDING PLATFORM-PRE-DAWN,,3,theres been a rebellion dont worry sir the situation is under control
clone sergeant,,"(continuing) I'm sorry, sir. No one is allowed entry.",148 EXT. CORUSCANT-JEDI TEMPLE-LANDING PLATFORM-PRE-DAWN,,3,continuing im sorry sir no one is allowed entry
clone sergeant,,"(continuing) It's time for you to leave, sir.",148 EXT. CORUSCANT-JEDI TEMPLE-LANDING PLATFORM-PRE-DAWN,,3,continuing its time for you to leave sir
bail organa,,And so it is.,148 EXT. CORUSCANT-JEDI TEMPLE-LANDING PLATFORM-PRE-DAWN,,3,and so it is
clone commander appo,,Get him! Shoot him!,148 EXT. CORUSCANT-JEDI TEMPLE-LANDING PLATFORM-PRE-DAWN,,3,get him shoot him
at-st clone sergeant,,Everyone out of there!,152 EXT. KASHYYYK-LAKE ON VILLAGE EDGE-DUSK,,3,everyone out of there
creature,,Wookiee good... eat Wookiee. (crazy little laugh),152 EXT. KASHYYYK-LAKE ON VILLAGE EDGE-DUSK,,3,wookiee good eat wookiee crazy little laugh
clone sergeant,,Did you find something?,152 EXT. KASHYYYK-LAKE ON VILLAGE EDGE-DUSK,,3,did you find something
creature,,"It's nothing, nothing. (laughs)",152 EXT. KASHYYYK-LAKE ON VILLAGE EDGE-DUSK,,3,its nothing nothing laughs
clone sergeant,,"It's nothing, nothing. All these WOOKIES are dead. Move to the east.",152 EXT. KASHYYYK-LAKE ON VILLAGE EDGE-DUSK,,3,its nothing nothing all these wookies are dead move to the east
clone trooper,,"Yes, sir.",152 EXT. KASHYYYK-LAKE ON VILLAGE EDGE-DUSK,,3,yes sir
creature,,"Right you are, Chewbacca. Faster that will be.",152 EXT. KASHYYYK-LAKE ON VILLAGE EDGE-DUSK,,3,right you are chewbacca faster that will be
yoda,,"Stink, this mud does. A moment to bathe, give me.",152 EXT. KASHYYYK-LAKE ON VILLAGE EDGE-DUSK,,3,stink this mud does a moment to bathe give me
yoda,,"(continuing) Not far, are we, from the emergency ship. Quickly...",152 EXT. KASHYYYK-LAKE ON VILLAGE EDGE-DUSK,,3,continuing not far are we from the emergency ship quickly
yoda,,"Good-bye. Chewbacca and Tarfful, miss you I will. Good friends you are. For your help, much gratitude and respect, I have",153 EXT. KASHYYYK-HILLS OVERLOOKING LAKE-DUSK,,3,goodbye chewbacca and tarfful miss you i will good friends you are for your help much gratitude and respect i have
royal guard,,Identification...,154 EXT. CORUSCANT-SENATE OFFICE BUILDING-UNDERGROUND STARSHIP LANDING PLATFORM-DAY,,3,identification
bail organa,,Senator Bail Organa of Alderaan.,154 EXT. CORUSCANT-SENATE OFFICE BUILDING-UNDERGROUND STARSHIP LANDING PLATFORM-DAY,,3,senator bail organa of alderaan
bail organa,,Were you able to get hold of a Jedi homing beacon?,156 INT. ALDERAAN-STARCRUISER-HALLWAY-DAY,,3,were you able to get hold of a jedi homing beacon
captain antilles,,"Yes, sir. We've encountered no opposition. The clones are still a bit confused. It appears no one is in command.",156 INT. ALDERAAN-STARCRUISER-HALLWAY-DAY,,3,yes sir weve encountered no opposition the clones are still a bit confused it appears no one is in command
bail organa,,That will change soon. Hopefully we will be able to intercept a few Jedi before they walk into this catastrophe.,156 INT. ALDERAAN-STARCRUISER-HALLWAY-DAY,,3,that will change soon hopefully we will be able to intercept a few jedi before they walk into this catastrophe
clone captain,,Did you find Kenobi?,157 EXT. UTAPAU-SINKHOLE WALL-LATE DAY,,3,did you find kenobi
clone trooper,,No one could have survived that fall.,157 EXT. UTAPAU-SINKHOLE WALL-LATE DAY,,3,no one could have survived that fall
clone captain,,Start loading your men on the ship.,157 EXT. UTAPAU-SINKHOLE WALL-LATE DAY,,3,start loading your men on the ship
clone trooper,,"Yes, sir.",157 EXT. UTAPAU-SINKHOLE WALL-LATE DAY,,3,yes sir
obi-wan,,Emergency Code Nine Thirteen... I have no contact on any frequency. Are there any Jedi out there?... anywhere...,160 INT. GENERAL GRIEVOUS'S STARFIGHTER-SPACE,,3,emergency code nine thirteen i have no contact on any frequency are there any jedi out there anywhere
bail organa,,(hologram)... Kenobi...,160 INT. GENERAL GRIEVOUS'S STARFIGHTER-SPACE,,3,hologram kenobi
obi-wan,,(continuing) I've locked on. Repeat.,160 INT. GENERAL GRIEVOUS'S STARFIGHTER-SPACE,,3,continuing ive locked on repeat
bail organa,,Master Kenobi??,160 INT. GENERAL GRIEVOUS'S STARFIGHTER-SPACE,,3,master kenobi
obi-wan,,Senator Organa! My Clone Troops turned on me... I need help.,160 INT. GENERAL GRIEVOUS'S STARFIGHTER-SPACE,,3,senator organa my clone troops turned on me i need help
bail organa,,We have just rescued Master Yoda. It appears this ambush has happened everywhere. We're sending you our coordinates.,160 INT. GENERAL GRIEVOUS'S STARFIGHTER-SPACE,,3,we have just rescued master yoda it appears this ambush has happened everywhere were sending you our coordinates
c-3po,,"My Lady, there's a Jedi fighter docking on the veranda.",161 INT. CORUSCANT-PADMESAPARTMENT-PRE-DAWN,,3,my lady theres a jedi fighter docking on the veranda
c-3po,,Hush! Not so loud!,161 INT. CORUSCANT-PADMESAPARTMENT-PRE-DAWN,,3,hush not so loud
padme,,Are you all right? I heard there was an attack on the Jedi Temple... you can see the smoke from here.,161 INT. CORUSCANT-PADMESAPARTMENT-PRE-DAWN,,3,are you all right i heard there was an attack on the jedi temple you can see the smoke from here
anakin,,I'm fine. I'm fine. I came to see if you and the baby are safe.,161 INT. CORUSCANT-PADMESAPARTMENT-PRE-DAWN,,3,im fine im fine i came to see if you and the baby are safe
padme,,"Captain Typho's here, we're safe. What's happening?",161 INT. CORUSCANT-PADMESAPARTMENT-PRE-DAWN,,3,captain typhos here were safe whats happening
c-3po,,What is going on?,161 INT. CORUSCANT-PADMESAPARTMENT-PRE-DAWN,,3,what is going on
c-3po,,(continuing) You can't be anymore confused than I am.,161 INT. CORUSCANT-PADMESAPARTMENT-PRE-DAWN,,3,continuing you cant be anymore confused than i am
anakin,,The situation is not good. The Jedi have tried to overthrow the Republic...,161 INT. CORUSCANT-PADMESAPARTMENT-PRE-DAWN,,3,the situation is not good the jedi have tried to overthrow the republic
padme,,I can't believe that!,161 INT. CORUSCANT-PADMESAPARTMENT-PRE-DAWN,,3,i cant believe that
anakin,,"I couldn't either at first, but it's true. I saw Master Windu attempt to assassinate the Chancellor myself.",161 INT. CORUSCANT-PADMESAPARTMENT-PRE-DAWN,,3,i couldnt either at first but its true i saw master windu attempt to assassinate the chancellor myself
c-3po,,Something important is going on! I heard a rumor they are going to banish all droids.,161 INT. CORUSCANT-PADMESAPARTMENT-PRE-DAWN,,3,something important is going on i heard a rumor they are going to banish all droids
c-3po,,(continuing) Shhhhhh... not so loud.,161 INT. CORUSCANT-PADMESAPARTMENT-PRE-DAWN,,3,continuing shhhhhh not so loud
c-3po,,"(continuing) Whatever it is, we'll be the last to know.",161 INT. CORUSCANT-PADMESAPARTMENT-PRE-DAWN,,3,continuing whatever it is well be the last to know
padme,,"Anakin, what are you going to do?",161 INT. CORUSCANT-PADMESAPARTMENT-PRE-DAWN,,3,anakin what are you going to do
anakin,,I will not betray the Republic... my loyalties lie with the Chancellor and with the Senate... and with you.,161 INT. CORUSCANT-PADMESAPARTMENT-PRE-DAWN,,3,i will not betray the republic my loyalties lie with the chancellor and with the senate and with you
padme,,What about Obi-Wan?,161 INT. CORUSCANT-PADMESAPARTMENT-PRE-DAWN,,3,what about obiwan
anakin,,I don't know... Many Jedi have been killed. We can only hope that he's remained loyal to the Chancellor.,161 INT. CORUSCANT-PADMESAPARTMENT-PRE-DAWN,,3,i dont know many jedi have been killed we can only hope that hes remained loyal to the chancellor
padme,,How could this have happened?,161 INT. CORUSCANT-PADMESAPARTMENT-PRE-DAWN,,3,how could this have happened
anakin,,"The Republic is unstable, Padme. The Jedi aren't the only ones trying to take advantage of the situation. There are also traitors in the Senate.",161 INT. CORUSCANT-PADMESAPARTMENT-PRE-DAWN,,3,the republic is unstable padme the jedi arent the only ones trying to take advantage of the situation there are also traitors in the senate
padme,,What are you saying?,161 INT. CORUSCANT-PADMESAPARTMENT-PRE-DAWN,,3,what are you saying
